source_id,descript,spi_indicator_description
SPI.INDEX,SPI Overall Score,Overall Statistical Performance Indicators Index Score
SPI.INDEX.PIL1,Pillar 1  - Data Use - Score,Indicators that capture demand side of statistical system
SPI.INDEX.PIL2,Pillar 2 - Data Services - Score,"Information on data releases, online access, and other data services"
SPI.INDEX.PIL3,Pillar 3 - Data Products - Score,"Whether the country is able to produce relevant indicators, primarily related to SDGs"
SPI.INDEX.PIL4,Pillar 4 - Data Sources - Score,"Censuses and surveys, admin data, geospatial"
SPI.INDEX.PIL5,Pillar 5 - Data Infrastructure - Score,Standards and methodology used in classification
